{
  "id": "adolescence-moral-awakening",
  "category": "emotional",
  "lifeStages": ["adolescence"],
  "prerequisites": {
    "type": "jsonLogic",
    "rule": {
      "and": [
        { ">=": [{ "var": "stats.age" }, 14] },
        { "<=": [{ "var": "stats.age" }, 17] }
      ]
    }
  },
  "weight": 20,
  "priority": "weighted",
  "title": "The Injustice",
  "description": "You watch someone get blamed for something they didn't do. The crowd goes along with it. You know the truth. Do you speak up?",
  "moods": [
    { "id": "defiant", "label": "Defiant", "emoji": "😤", "color": "#ef4444" },
    { "id": "vulnerable", "label": "Vulnerable", "emoji": "😢", "color": "#3b82f6" },
    { "id": "confused", "label": "Confused", "emoji": "🤔", "color": "#8b5cf6" }
  ],
  "choices": [
    {
      "id": "speak-up",
      "label": "Stand up and tell the truth",
      "outcomes": [
        {
          "condition": { "type": "jsonLogic", "rule": { "always": true } },
          "narration": "Your voice shakes but you speak anyway. People turn to look. The accused looks at you with desperate gratitude. It costs you socially, but you sleep well.",
          "statChanges": {
            "morality": 18,
            "confidence": 15,
            "social": -12
          },
          "consequences": {
            "tag": "stood-alone",
            "relationshipChanges": []
          }
        }
      ]
    },
    {
      "id": "stay-silent",
      "label": "Stay silent, it's not your fight",
      "outcomes": [
        {
          "condition": { "type": "jsonLogic", "rule": { "always": true } },
          "narration": "You look away. Someone else gets punished for your silence. The guilt stays with you, a weight you can't shake.",
          "statChanges": {
            "happiness": -15,
            "morality": -10,
            "resilience": 5
          },
          "consequences": {
            "relationshipChanges": []
          }
        }
      ]
    },
    {
      "id": "find-proof",
      "label": "Stay quiet publicly but gather evidence privately",
      "outcomes": [
        {
          "condition": { "type": "jsonLogic", "rule": { "always": true } },
          "narration": "You bide your time, collect what you need. A week later you present your evidence to the right authority. The truth comes out. Your way.",
          "statChanges": {
            "intellectual": 15,
            "morality": 10,
            "empathy": 8
          },
          "consequences": {
            "tag": "stood-alone",
            "relationshipChanges": []
          }
        }
      ]
    }
  ]
}
